{
  "_layout": "footer",
  "_isSingleton": true,
  "primaryLinks": [
    {
      "to": "/getting-started/",
      "text": "Getting Started",
      "isExternal": false
    },
    {
      "to": "/guidance/introduction",
      "text": "Guidance",
      "isExternal": false
    },
    {
      "to": "/starters/introduction",
      "text": "Starters",
      "isExternal": false
    },
    {
      "to": "/cms/introduction",
      "text": "CMS",
      "isExternal": false
    }
  ],
  "secondaryLinks": [
    {
      "to": "https://github.com/microsoft/blueprints",
      "text": "GitHub",
      "isExternal": true
    },
    {
      "to": "https://develop.fluentui.dev/",
      "text": "Fluent",
      "isExternal": true
    },
    {
      "to": "https://microsoft.com/",
      "text": "Microsoft Design",
      "isExternal": true
    }
  ]
}
